{"schema":"appsec-review/tooling-profile/0.1","tooling_profile_id":"immutable-final-publication","display_name":"Immutable Final Publication","mode":"static-only","required_inputs":["exact immutable draft publication","append-only human signoff ledger"],"optional_inputs":[],"allowed_actions":["validate SHA-256 bindings","derive SARIF from traced verified findings","atomically publish an approved package"],"disallowed_actions":["execute target content","access network","invent human approval","replace an existing package"],"claim_limits":{"allowed":["final-publication-package","human-signoff-ledger","verified-findings-sarif"],"forbidden":["invented-signoff","unverified-finding","changed-draft-evidence"]}}
