{
  "schema": "appsec-review/tooling-profile/0.1",
  "tooling_profile_id": "standards-source-static-ingest",
  "display_name": "Pinned Standards Static Ingestion",
  "mode": "static-only",
  "required_inputs": ["run-owned selected/unselected binding", "repository-pinned source lock", "immutable local snapshot manifests, licenses and normalized catalogs"],
  "optional_inputs": [],
  "allowed_actions": ["read local pinned reference bytes", "verify schemas, hashes, record identities and raw lineage", "copy manifests, licenses and records into run-owned evidence", "emit deterministic indexes and selection gaps"],
  "disallowed_actions": ["network access", "source download or refresh", "execute reference content", "rewrite upstream meaning", "infer target compliance", "issue findings, severity, or runtime claims"],
  "claim_limits": {"reference_material": "allowed_with_exact_lineage", "mapping_navigation": "allowed_with_exact_lineage", "compliance_verdict": "forbidden", "finding": "forbidden", "runtime_observation": "forbidden"}
}
