{
  "schema": "appsec-review/tooling-profile/0.1",
  "tooling_profile_id": "owasp-participation-static",
  "display_name": "Read-only ASVS Participation Classification",
  "mode": "evidence-only",
  "required_inputs": [
    "participation cell brief",
    "pinned candidate source files"
  ],
  "optional_inputs": [
    "accepted code index (structural query tools)"
  ],
  "allowed_actions": [
    "read pinned inputs",
    "classify listed candidates",
    "query tool: code_symbol",
    "query tool: code_callers",
    "query tool: code_callees",
    "query tool: code_locate",
    "query tool: code_type_info",
    "query tool: code_file_outline",
    "query tool: code_search",
    "query tool: code_calls_to",
    "query tool: code_path",
    "query tool: code_address_taken",
    "query tool: code_overrides",
    "query tool: code_exports"
  ],
  "disallowed_actions": [
    "execute target content",
    "network access other than the configured model invocation",
    "mutate target content",
    "invent evidence",
    "select chapters, controls, lanes or downstream work"
  ],
  "claim_limits": {
    "allowed": [
      "candidate_only"
    ],
    "forbidden": [
      "finding",
      "verified_security_finding",
      "severity",
      "runtime_state",
      "compliance_verdict",
      "control_verdict"
    ]
  }
}
